{
  "type": "summary",
  "title": "Summary",
  "output": {
    "path": "sources/watchdog-2024-migrate-with-no-downtime/generated/gen-9a03fbd7e3ff.md",
    "media_type": "text/markdown",
    "sha256": "sha256:0a47acc34d747592e28222532ff7c4681aabebe8d3bc24dae7c2f4c71f84674f"
  },
  "stale": false,
  "provenance": {
    "produced_by": {
      "tool": "researchassistant",
      "tool_version": "1.0.0",
      "model": "some-model",
      "method": "model",
      "prompt_version": "summarize@2"
    },
    "created_at": "2026-08-17T12:00:00Z",
    "derived_from": {
      "source_ids": [
        "src-b95bb22d8232"
      ],
      "representation_refs": [
        "rep-53de3cc48d82"
      ],
      "extraction_ids": [
        "ext-d8129f9b7114"
      ]
    },
    "input_digest": "sha256:53de3cc48d826dab705aa4f8af91145a1388ecd93f630726fe6fc136e0cc0c9c",
    "activity_ref": "evt-000004"
  },
  "generation_id": "gen-9a03fbd7e3ff"
}
